{
  "predecessor_run_id": "RUN-PRED00000001",
  "predecessor_artifact_id": "SDC-PRED0000001",
  "predecessor_content_hash": "sha256:aaaaaaaaaaaaaaaaaaaaaaaaaaaaaaaaaaaaaaaaaaaaaaaaaaaaaaaaaaaaaaaa",
  "predecessor_dependency_fingerprint": "sha256:bbbbbbbbbbbbbbbbbbbbbbbbbbbbbbbbbbbbbbbbbbbbbbbbbbbbbbbbbbbbbbbb"
}
